{"componentChunkName":"component---src-pages-mdx-parent-file-source-instance-name-mdx-parent-file-name-js","path":"/projects/portfolio-site/","result":{"data":{"mdx":{"id":"0203c54e-cf45-5789-8f1c-e35f5a7e1ec8","body":"var _excluded = [\"components\"];\n\nfunction _extends() { _extends = Object.assign ? Object.assign.bind() : function (target) { for (var i = 1; i < arguments.length; i++) { var source = arguments[i]; for (var key in source) { if (Object.prototype.hasOwnProperty.call(source, key)) { target[key] = source[key]; } } } return target; }; return _extends.apply(this, arguments); }\n\nfunction _objectWithoutProperties(source, excluded) { if (source == null) return {}; var target = _objectWithoutPropertiesLoose(source, excluded); var key, i; if (Object.getOwnPropertySymbols) { var sourceSymbolKeys = Object.getOwnPropertySymbols(source); for (i = 0; i < sourceSymbolKeys.length; i++) { key = sourceSymbolKeys[i]; if (excluded.indexOf(key) >= 0) continue; if (!Object.prototype.propertyIsEnumerable.call(source, key)) continue; target[key] = source[key]; } } return target; }\n\nfunction _objectWithoutPropertiesLoose(source, excluded) { if (source == null) return {}; var target = {}; var sourceKeys = Object.keys(source); var key, i; for (i = 0; i < sourceKeys.length; i++) { key = sourceKeys[i]; if (excluded.indexOf(key) >= 0) continue; target[key] = source[key]; } return target; }\n\n/* @jsxRuntime classic */\n\n/* @jsx mdx */\nvar vars = {\n  title: \"marissaangell.github.io\",\n  summary: \"The source code for this site! Made using the Gatsby JS framework.\",\n  descriptions: [{\n    heading: 'Tools & Languages',\n    body: 'Gatsby, React, GraphQL, Tailwind CSS'\n  }, {\n    heading: 'Project Timeline',\n    body: 'August 2022 - Present'\n  }]\n};\nvar _frontmatter = {\n  \"title\": \"marissaangell.github.io\",\n  \"date\": \"2022-08-13\",\n  \"description\": \"The source code for this site! Made using the Gatsby JS framework.\",\n  \"externalLinks\": [{\n    \"url\": \"https://github.com/marissaangell/marissaangell.github.io\",\n    \"desc\": \"Source\",\n    \"icon\": \"Github\"\n  }, {\n    \"url\": \"https://marissaangell.github.io/\",\n    \"desc\": \"Demo\",\n    \"icon\": \"Ext\"\n  }],\n  \"languages\": [\"React\", \"Gatsby\", \"HTML\", \"CSS\", \"GraphQL\"],\n  \"tags\": [\"web-app\"]\n};\n\nvar makeShortcode = function makeShortcode(name) {\n  return function MDXDefaultShortcode(props) {\n    console.warn(\"Component \" + name + \" was not imported, exported, or provided by MDXProvider as global scope\");\n    return mdx(\"div\", props);\n  };\n};\n\nvar TwoColumn = makeShortcode(\"TwoColumn\");\nvar LinkButtonRow = makeShortcode(\"LinkButtonRow\");\nvar ProseWrapper = makeShortcode(\"ProseWrapper\");\nvar layoutProps = {\n  vars: vars,\n  _frontmatter: _frontmatter\n};\nvar MDXLayout = \"wrapper\";\nreturn function MDXContent(_ref) {\n  var components = _ref.components,\n      props = _objectWithoutProperties(_ref, _excluded);\n\n  return mdx(MDXLayout, _extends({}, layoutProps, props, {\n    components: components,\n    mdxType: \"MDXLayout\"\n  }), mdx(TwoColumn, {\n    vars: vars,\n    centerRightCol: true,\n    mdxType: \"TwoColumn\"\n  }), mdx(\"div\", {\n    className: \"divider py-4\"\n  }), mdx(\"div\", {\n    className: \"max-w-3xl mx-auto\"\n  }, mdx(LinkButtonRow, {\n    links: [{\n      url: \"https://github.com/marissaangell/marissaangell.github.io\",\n      text: \"Source Code\"\n    }],\n    mdxType: \"LinkButtonRow\"\n  }), mdx(ProseWrapper, {\n    mdxType: \"ProseWrapper\"\n  }, mdx(\"h2\", null, \"Background\"), mdx(\"p\", null, \"I actually got my start in programming through self-studying web development (HTML, CSS, and vanilla JavaScript) from Codecademy all the way back in 2012. My first project was the simplest portfolio website you'd ever seen, but it made me fall in love with code and decide to become a software engineer - so it'll always hold a special place in my heart.\"), mdx(\"p\", null, \"Once I started my CS degree, however, I was sucked into the realm of back-end and had little time to practice front-end work. Fast forward three years to Summer 2022, and having just finished my junior year I was ready to remedy that. So, I decided to make this site as a foray into modern web development! \"), mdx(\"h2\", null, \"Inspiration\"), mdx(\"p\", null, \"Before beginning development of this site, I looked at a lot of developer websites and portfolios to try and get an idea of how I wanted to approach the site's design. Out of everything I looked at, my favorite was \", mdx(\"a\", {\n    parentName: \"p\",\n    \"href\": \"https://www.taniarascia.com/\"\n  }, \"Tania Rascia's site\"), \" (in particular, the layout she calls \", mdx(\"a\", {\n    parentName: \"p\",\n    \"href\": \"https://www.taniarascia.com/redesign-version-6/\"\n  }, \"redesign version 6.0\"), \") - it was nice to look at, simple to navigate, and organized really well. I especially loved how she organized her side projects, tutorials, and blog posts; it's clear that she wanted to emphasize usability, and that's something I wanted to try and emulate.\")), mdx(\"img\", {\n    src: img1,\n    className: \"mt-6\"\n  }), mdx(\"p\", {\n    className: \"max-w-lg mx-auto mb-12\"\n  }, mdx(\"i\", null, \"Tania's projects page. All the info you need in a clear & concise package!\")), mdx(\"div\", {\n    className: \"mt-10\"\n  }), mdx(ProseWrapper, {\n    mdxType: \"ProseWrapper\"\n  }, mdx(\"h2\", null, \"Technologies\"), mdx(\"p\", null, \"Before starting this site, I of course had big decisions to make; namely, what tools to use for the job? I was not caught up on the state of modern web development - my last big front-end projects were a Ruby-on-Rails blog site and a barebones React app, both made around 2016 - so I had my work cut out for me in the beginning to get up-to-speed with the languages and frameworks that had come out since then. \"), mdx(\"p\", null, \"After several hours of research, I ended up deciding on the following:\"), mdx(\"ul\", null, mdx(\"li\", {\n    parentName: \"ul\"\n  }, mdx(\"inlineCode\", {\n    parentName: \"li\"\n  }, \"Gatsby\")), mdx(\"li\", {\n    parentName: \"ul\"\n  }, mdx(\"inlineCode\", {\n    parentName: \"li\"\n  }, \"GraphQL\")), mdx(\"li\", {\n    parentName: \"ul\"\n  }, mdx(\"inlineCode\", {\n    parentName: \"li\"\n  }, \"Tailwind CSS\"), mdx(\"ul\", {\n    parentName: \"li\"\n  }, mdx(\"li\", {\n    parentName: \"ul\"\n  }, \"I never thought I would end up falling in love with semantic CSS, but Tailwind changed that. Being able to tweak the React, HTML and CSS all from the same file was a game changer, especially when trying to iterate on designs quickly.\"), mdx(\"li\", {\n    parentName: \"ul\"\n  }, \"Plus, Tailwind has a small ecosystem of its own - I was able to take advantage of the fantastic open-source component library \", mdx(\"a\", {\n    parentName: \"li\",\n    \"href\": \"https://daisyui.com/\"\n  }, mdx(\"inlineCode\", {\n    parentName: \"a\"\n  }, \"daisyUI\")), \", which was great in helping me get more comfortable with making my own components. \")))))));\n}\n;\nMDXContent.isMDXComponent = true;","frontmatter":{"tags":["web-app"],"languages":["React","Gatsby","HTML","CSS","GraphQL"],"date":"2022-08-13","title":"marissaangell.github.io"},"parent":{"sourceInstanceName":"projects","name":"portfolio-site"}}},"pageContext":{"id":"0203c54e-cf45-5789-8f1c-e35f5a7e1ec8","parent__sourceInstanceName":"projects","parent__name":"portfolio-site","__params":{"parent__sourceInstanceName":"projects","parent__name":"portfolio-site"}}},"staticQueryHashes":["3159585216"]}